{
  "card_id": "demo-mildew-001",
  "timestamp": "2026-07-15T09:30:00Z",
  "grape_variety": "Шардоне (Chardonnay)",
  "visual_symptoms": {
    "chlorosis": "жовтуваті «маслянисті» плями на верхній стороні листка, обмежені дрібними жилками",
    "necrosis": "сухі бурі зони в центрі маслянистих плям на старих нижніх листках",
    "spots_and_plaque": "білуватий павутиноподібний наліт на нижньому боці плям (спороношення збудника)",
    "leaf_deformation": "слабке скручування країв уражених листків"
  },
  "diagnosis": {
    "diseases": [
      { "name": "Мілдью (Plasmopara viticola)", "confidence_score": 0.92, "stage": "прогресуюча" }
    ],
    "nutrient_deficiencies": []
  },
  "recommendations": {
    "agrotechnical": ["видалити й знищити уражені листки", "прорідити зону грон для провітрювання"],
    "chemical_or_biological_treatment": ["контактний фунгіцид на основі міді (напр. бордоська рідина) за інструкцією виробника", "при повторному дощовому періоді — системний препарат групи CAA або фенамідону, чергування груп для профілактики резистентності"],
    "fertilization": ["позакореневе підживлення калієм для підтримки імунітету куща (0.3% розчин KNO3)"]
  },
  "verification_status": "confirmed_by_user",
  "user_notes": "Приклад few-shot: мілдью на Шардоне після дощового тижня"
}
