{
  "card_id": "demo-oidium-fe-003",
  "timestamp": "2026-08-20T17:45:00Z",
  "grape_variety": "Невідомо",
  "visual_symptoms": {
    "chlorosis": "рівномірний жовтуватий хлороз молодих верхніх листків (перші 3-5 листків від пагона)",
    "necrosis": "окремі сухі бурі плями з виразним сухим краєм на середньому ярусі",
    "spots_and_plaque": "сірувато-білий борошнистий наліт, що легко стирається, на верхньому боці листків середнього ярусу",
    "leaf_deformation": "скручування та гофрування уражених молодих листків"
  },
  "diagnosis": {
    "diseases": [
      { "name": "Оїдіум (Uncinula necator / Erysiphe necator)", "confidence_score": 0.82, "stage": "рання" }
    ],
    "nutrient_deficiencies": [
      { "element": "Залізо (Fe)", "confidence_score": 0.78, "severity": "легка" }
    ]
  },
  "recommendations": {
    "agrotechnical": ["знищити опале листя під кущами (джерело інфекції оїдіуму)", "прорідити листя в зоні грон для циркуляції повітря"],
    "chemical_or_biological_treatment": ["сірчаний препарат (колоїдна сірка або сірні пари при T > 20 °C, не вище 30 °C) за інструкцією виробника", "при поширенні — системний фунгіцид групи DMI, дотримуючись строку очікування до збору"],
    "fertilization": ["хелатне залізо (Fe-EDDHA) позакоренево 0.1-0.2% або коренево на карбонатних ґрунтах", "не застосовувати фосфорні добрива одночасно з Fe (антагонізм)"]
  },
  "verification_status": "confirmed_by_user",
  "user_notes": "Приклад few-shot: комбіноване ураження — оїдіум + дефіцит Fe. Зверни увагу на розмежування симптомів."
}
